root@lamponubuntu2204-s-1vcpu-1gb-tor1-01:~# tcpdump -c 5 -i eth0
tcpdump: verbose output suppressed, use -v[v]... for full protocol decode
listening on eth0, link-type EN10MB (Ethernet), snapshot length 262144 bytes
21:25:14.151825 IP lamponubuntu2204-s-1vcpu-1gb-tor1-01.ssh > 198.96.85.163.50233: Flags [P.], seq 2550394956:2550395064, ack 3450890212, win 501, options [nop,nop,TS val 1540593887 ecr 2775770074], length 108
21:25:14.151943 IP lamponubuntu2204-s-1vcpu-1gb-tor1-01.ssh > 198.96.85.163.50233: Flags [P.], seq 108:264, ack 1, win 501, options [nop,nop,TS val 1540593887 ecr 2775770074], length 156
21:25:14.152019 IP lamponubuntu2204-s-1vcpu-1gb-tor1-01.ssh > 198.96.85.163.50233: Flags [P.], seq 264:332, ack 1, win 501, options [nop,nop,TS val 1540593887 ecr 2775770074], length 68
21:25:14.152261 IP lamponubuntu2204-s-1vcpu-1gb-tor1-01.ssh > 198.96.85.163.50233: Flags [P.], seq 332:368, ack 1, win 501, options [nop,nop,TS val 1540593887 ecr 2775770074], length 36
21:25:14.154327 IP 198.96.85.163.50233 > lamponubuntu2204-s-1vcpu-1gb-tor1-01.ssh: Flags [.], ack 368, win 2042, options [nop,nop,TS val 2775770080 ecr 1540593887], length 0
5 packets captured
30 packets received by filter
0 packets dropped by kernel