root@lamponubuntu2204-s-1vcpu-1gb-tor1-01:~# tcpdump -n -i eth0
tcpdump: verbose output suppressed, use -v[v]... for full protocol decode
listening on eth0, link-type EN10MB (Ethernet), snapshot length 262144 bytes
21:34:51.961448 IP 137.184.160.43.22 > 198.96.85.163.50233: Flags [P.], seq 2560014636:2560014744, ack 3450902856, win 501, options [nop,nop,TS val 1541171696 ecr 2776344703], length 108
21:34:51.961524 IP 137.184.160.43.22 > 198.96.85.163.50233: Flags [P.], seq 108:144, ack 1, win 501, options [nop,nop,TS val 1541171696 ecr 2776344703], length 36
21:34:51.961567 IP 137.184.160.43.22 > 198.96.85.163.50233: Flags [P.], seq 144:196, ack 1, win 501, options [nop,nop,TS val 1541171696 ecr 2776344703], length 52
21:34:51.961603 IP 137.184.160.43.22 > 198.96.85.163.50233: Flags [P.], seq 196:264, ack 1, win 501, options [nop,nop,TS val 1541171696 ecr 2776344703], length 68
21:34:51.961669 IP 137.184.160.43.22 > 198.96.85.163.50233: Flags [P.], seq 264:332, ack 1, win 501, options [nop,nop,TS val 1541171697 ecr 2776344703], length 68
21:34:51.962001 IP 137.184.160.43.22 > 198.96.85.163.50233: Flags [P.], seq 332:368, ack 1, win 501, options [nop,nop,TS val 1541171697 ecr 2776344703], length 36
21:34:51.969504 IP 198.96.85.163.50233 > 137.184.160.43.22: Flags [.], ack 0, win 3373, options [nop,nop,TS val 2776344708 ecr 1541171693], length 0
21:34:51.969504 IP 198.96.85.163.50233 > 137.184.160.43.22: Flags [.], ack 332, win 3368, options [nop,nop,TS val 2776344712 ecr 1541171697], length 0
21:34:51.969792 IP 198.96.85.163.50233 > 137.184.160.43.22: Flags [.], ack 368, win 3373, options [nop,nop,TS val 2776344716 ecr 1541171697], length 0
21:34:52.004762 IP 139.144.168.186 > 137.184.160.43: ICMP echo request, id 53033, seq 0, length 8
21:34:52.004830 IP 137.184.160.43 > 139.144.168.186: ICMP echo reply, id 53033, seq 0, length 8
21:34:52.062086 IP 137.184.160.43.22 > 198.96.85.163.50233: Flags [P.], seq 368:588, ack 1, win 501, options [nop,nop,TS val 1541171797 ecr 2776344716], length 220
21:34:52.062180 IP 137.184.160.43.22 > 198.96.85.163.50233: Flags [P.], seq 588:820, ack 1, win 501, options [nop,nop,TS val 1541171797 ecr 2776344716], length 232
21:34:52.062256 IP 137.184.160.43.22 > 198.96.85.163.50233: Flags [P.], seq 820:1052, ack 1, win 501, options [nop,nop,TS val 1541171797 ecr 2776344716], length 232
21:34:52.062297 IP 137.184.160.43.22 > 198.96.85.163.50233: Flags [P.], seq 1052:1088, ack 1, win 501, options [nop,nop,TS val 1541171797 ecr 2776344716], length 36
21:34:52.062353 IP 137.184.160.43.22 > 198.96.85.163.50233: Flags [P.], seq 1088:1284, ack 1, win 501, options [nop,nop,TS val 1541171797 ecr 2776344716], length 196
21:34:52.062384 IP 137.184.160.43.22 > 198.96.85.163.50233: Flags [P.], seq 1284:1320, ack 1, win 501, options [nop,nop,TS val 1541171797 ecr 2776344716], length 36
21:34:52.062428 IP 137.184.160.43.22 > 198.96.85.163.50233: Flags [P.], seq 1320:1516, ack 1, win 501, options [nop,nop,TS val 1541171797 ecr 2776344716], length 196
21:34:52.062493 IP 137.184.160.43.22 > 198.96.85.163.50233: Flags [P.], seq 1516:1748, ack 1, win 501, options [nop,nop,TS val 1541171797 ecr 2776344716], length 232
21:34:52.064830 IP 198.96.85.163.50233 > 137.184.160.43.22: Flags [.], ack 1748, win 3352, options [nop,nop,TS val 2776344810 ecr 1541171797], length 0
21:34:52.064891 IP 137.184.160.43.22 > 198.96.85.163.50233: Flags [P.], seq 1748:2792, ack 1, win 501, options [nop,nop,TS val 1541171800 ecr 2776344810], length 1044
21:34:52.067397 IP 198.96.85.163.50233 > 137.184.160.43.22: Flags [.], ack 2792, win 3357, options [nop,nop,TS val 2776344812 ecr 1541171800], length 0
21:34:52.115153 IP 194.48.250.98.51769 > 137.184.160.43.1080: Flags [S], seq 1284106146, win 1025, options [mss 1460], length 0
21:34:52.165947 IP 137.184.160.43.22 > 198.96.85.163.50233: Flags [P.], seq 2792:2996, ack 1, win 501, options [nop,nop,TS val 1541171901 ecr 2776344812], length 204
21:34:52.166011 IP 137.184.160.43.22 > 198.96.85.163.50233: Flags [P.], seq 2996:3032, ack 1, win 501, options [nop,nop,TS val 1541171901 ecr 2776344812], length 36
21:34:52.166059 IP 137.184.160.43.22 > 198.96.85.163.50233: Flags [P.], seq 3032:3236, ack 1, win 501, options [nop,nop,TS val 1541171901 ecr 2776344812], length 204
21:34:52.166152 IP 137.184.160.43.22 > 198.96.85.163.50233: Flags [P.], seq 3236:3512, ack 1, win 501, options [nop,nop,TS val 1541171901 ecr 2776344812], length 276
21:34:52.166185 IP 137.184.160.43.22 > 198.96.85.163.50233: Flags [P.], seq 3512:3716, ack 1, win 501, options [nop,nop,TS val 1541171901 ecr 2776344812], length 204
21:34:52.166215 IP 137.184.160.43.22 > 198.96.85.163.50233: Flags [P.], seq 3716:3752, ack 1, win 501, options [nop,nop,TS val 1541171901 ecr 2776344812], length 36
21:34:52.166261 IP 137.184.160.43.22 > 198.96.85.163.50233: Flags [P.], seq 3752:3956, ack 1, win 501, options [nop,nop,TS val 1541171901 ecr 2776344812], length 204
21:34:52.166292 IP 137.184.160.43.22 > 198.96.85.163.50233: Flags [P.], seq 3956:3992, ack 1, win 501, options [nop,nop,TS val 1541171901 ecr 2776344812], length 36
21:34:52.171966 IP 198.96.85.163.50233 > 137.184.160.43.22: Flags [.], ack 3992, win 3355, options [nop,nop,TS val 2776344916 ecr 1541171901], length 0
21:34:52.172025 IP 137.184.160.43.22 > 198.96.85.163.50233: Flags [P.], seq 3992:5600, ack 1, win 501, options [nop,nop,TS val 1541171907 ecr 2776344916], length 1608
21:34:52.174568 IP 198.96.85.163.50233 > 137.184.160.43.22: Flags [.], ack 5600, win 3349, options [nop,nop,TS val 2776344918 ecr 1541171907], length 0
21:34:52.269896 IP 137.184.160.43.22 > 198.96.85.163.50233: Flags [P.], seq 5600:5804, ack 1, win 501, options [nop,nop,TS val 1541172005 ecr 2776344918], length 204
21:34:52.269958 IP 137.184.160.43.22 > 198.96.85.163.50233: Flags [P.], seq 5804:5840, ack 1, win 501, options [nop,nop,TS val 1541172005 ecr 2776344918], length 36
21:34:52.270027 IP 137.184.160.43.22 > 198.96.85.163.50233: Flags [P.], seq 5840:6044, ack 1, win 501, options [nop,nop,TS val 1541172005 ecr 2776344918], length 204
21:34:52.270068 IP 137.184.160.43.22 > 198.96.85.163.50233: Flags [P.], seq 6044:6080, ack 1, win 501, options [nop,nop,TS val 1541172005 ecr 2776344918], length 36
21:34:52.270119 IP 137.184.160.43.22 > 198.96.85.163.50233: Flags [P.], seq 6080:6284, ack 1, win 501, options [nop,nop,TS val 1541172005 ecr 2776344918], length 204
21:34:52.270151 IP 137.184.160.43.22 > 198.96.85.163.50233: Flags [P.], seq 6284:6320, ack 1, win 501, options [nop,nop,TS val 1541172005 ecr 2776344918], length 36
21:34:52.270196 IP 137.184.160.43.22 > 198.96.85.163.50233: Flags [P.], seq 6320:6524, ack 1, win 501, options [nop,nop,TS val 1541172005 ecr 2776344918], length 204
21:34:52.270227 IP 137.184.160.43.22 > 198.96.85.163.50233: Flags [P.], seq 6524:6560, ack 1, win 501, options [nop,nop,TS val 1541172005 ecr 2776344918], length 36
21:34:52.270275 IP 137.184.160.43.22 > 198.96.85.163.50233: Flags [P.], seq 6560:6764, ack 1, win 501, options [nop,nop,TS val 1541172005 ecr 2776344918], length 204
21:34:52.270307 IP 137.184.160.43.22 > 198.96.85.163.50233: Flags [P.], seq 6764:6800, ack 1, win 501, options [nop,nop,TS val 1541172005 ecr 2776344918], length 36
21:34:52.272496 IP 198.96.85.163.50233 > 137.184.160.43.22: Flags [.], ack 6800, win 3355, options [nop,nop,TS val 2776345015 ecr 1541172005], length 0
21:34:52.272544 IP 137.184.160.43.22 > 198.96.85.163.50233: Flags [P.], seq 6800:8208, ack 1, win 501, options [nop,nop,TS val 1541172007 ecr 2776345015], length 1408
21:34:52.274967 IP 198.96.85.163.50233 > 137.184.160.43.22: Flags [.], ack 8208, win 3352, options [nop,nop,TS val 2776345017 ecr 1541172007], length 0
21:34:52.373914 IP 137.184.160.43.22 > 198.96.85.163.50233: Flags [P.], seq 8208:8412, ack 1, win 501, options [nop,nop,TS val 1541172109 ecr 2776345017], length 204
21:34:52.373978 IP 137.184.160.43.22 > 198.96.85.163.50233: Flags [P.], seq 8412:8448, ack 1, win 501, options [nop,nop,TS val 1541172109 ecr 2776345017], length 36
21:34:52.374038 IP 137.184.160.43.22 > 198.96.85.163.50233: Flags [P.], seq 8448:8652, ack 1, win 501, options [nop,nop,TS val 1541172109 ecr 2776345017], length 204
21:34:52.374071 IP 137.184.160.43.22 > 198.96.85.163.50233: Flags [P.], seq 8652:8688, ack 1, win 501, options [nop,nop,TS val 1541172109 ecr 2776345017], length 36
21:34:52.374117 IP 137.184.160.43.22 > 198.96.85.163.50233: Flags [P.], seq 8688:8892, ack 1, win 501, options [nop,nop,TS val 1541172109 ecr 2776345017], length 204
21:34:52.374181 IP 137.184.160.43.22 > 198.96.85.163.50233: Flags [P.], seq 8892:9132, ack 1, win 501, options [nop,nop,TS val 1541172109 ecr 2776345017], length 240
21:34:52.374271 IP 137.184.160.43.22 > 198.96.85.163.50233: Flags [P.], seq 9132:9408, ack 1, win 501, options [nop,nop,TS val 1541172109 ecr 2776345017], length 276
21:34:52.374319 IP 137.184.160.43.22 > 198.96.85.163.50233: Flags [P.], seq 9408:9612, ack 1, win 501, options [nop,nop,TS val 1541172109 ecr 2776345017], length 204
21:34:52.374350 IP 137.184.160.43.22 > 198.96.85.163.50233: Flags [P.], seq 9612:9648, ack 1, win 501, options [nop,nop,TS val 1541172109 ecr 2776345017], length 36
21:34:52.374394 IP 137.184.160.43.22 > 198.96.85.163.50233: Flags [P.], seq 9648:9852, ack 1, win 501, options [nop,nop,TS val 1541172109 ecr 2776345017], length 204
21:34:52.376549 IP 198.96.85.163.50233 > 137.184.160.43.22: Flags [.], ack 9852, win 3348, options [nop,nop,TS val 2776345118 ecr 1541172109], length 0
21:34:52.376602 IP 137.184.160.43.22 > 198.96.85.163.50233: Flags [P.], seq 9852:11296, ack 1, win 501, options [nop,nop,TS val 1541172111 ecr 2776345118], length 1444
21:34:52.378899 IP 198.96.85.163.50233 > 137.184.160.43.22: Flags [.], ack 11296, win 3351, options [nop,nop,TS val 2776345120 ecr 1541172111], length 0
21:34:52.477889 IP 137.184.160.43.22 > 198.96.85.163.50233: Flags [P.], seq 11296:11500, ack 1, win 501, options [nop,nop,TS val 1541172213 ecr 2776345120], length 204
21:34:52.478006 IP 137.184.160.43.22 > 198.96.85.163.50233: Flags [P.], seq 11500:11740, ack 1, win 501, options [nop,nop,TS val 1541172213 ecr 2776345120], length 240
21:34:52.478047 IP 137.184.160.43.22 > 198.96.85.163.50233: Flags [P.], seq 11740:11776, ack 1, win 501, options [nop,nop,TS val 1541172213 ecr 2776345120], length 36
21:34:52.478098 IP 137.184.160.43.22 > 198.96.85.163.50233: Flags [P.], seq 11776:11980, ack 1, win 501, options [nop,nop,TS val 1541172213 ecr 2776345120], length 204
21:34:52.478129 IP 137.184.160.43.22 > 198.96.85.163.50233: Flags [P.], seq 11980:12016, ack 1, win 501, options [nop,nop,TS val 1541172213 ecr 2776345120], length 36
21:34:52.478174 IP 137.184.160.43.22 > 198.96.85.163.50233: Flags [P.], seq 12016:12220, ack 1, win 501, options [nop,nop,TS val 1541172213 ecr 2776345120], length 204
21:34:52.478204 IP 137.184.160.43.22 > 198.96.85.163.50233: Flags [P.], seq 12220:12256, ack 1, win 501, options [nop,nop,TS val 1541172213 ecr 2776345120], length 36
21:34:52.478248 IP 137.184.160.43.22 > 198.96.85.163.50233: Flags [P.], seq 12256:12460, ack 1, win 501, options [nop,nop,TS val 1541172213 ecr 2776345120], length 204
21:34:52.478278 IP 137.184.160.43.22 > 198.96.85.163.50233: Flags [P.], seq 12460:12496, ack 1, win 501, options [nop,nop,TS val 1541172213 ecr 2776345120], length 36
21:34:52.478323 IP 137.184.160.43.22 > 198.96.85.163.50233: Flags [P.], seq 12496:12700, ack 1, win 501, options [nop,nop,TS val 1541172213 ecr 2776345120], length 204
21:34:52.480644 IP 198.96.85.163.50233 > 137.184.160.43.22: Flags [.], ack 12700, win 3352, options [nop,nop,TS val 2776345221 ecr 1541172213], length 0
21:34:52.480702 IP 137.184.160.43.22 > 198.96.85.163.50233: Flags [P.], seq 12700:14384, ack 1, win 501, options [nop,nop,TS val 1541172216 ecr 2776345221], length 1684
21:34:52.482927 IP 198.96.85.163.50233 > 137.184.160.43.22: Flags [.], ack 14384, win 3347, options [nop,nop,TS val 2776345223 ecr 1541172216], length 0
21:34:52.581915 IP 137.184.160.43.22 > 198.96.85.163.50233: Flags [P.], seq 14384:14588, ack 1, win 501, options [nop,nop,TS val 1541172317 ecr 2776345223], length 204
21:34:52.582031 IP 137.184.160.43.22 > 198.96.85.163.50233: Flags [P.], seq 14588:14828, ack 1, win 501, options [nop,nop,TS val 1541172317 ecr 2776345223], length 240
21:34:52.582102 IP 137.184.160.43.22 > 198.96.85.163.50233: Flags [P.], seq 14828:14864, ack 1, win 501, options [nop,nop,TS val 1541172317 ecr 2776345223], length 36
21:34:52.582141 IP 137.184.160.43.22 > 198.96.85.163.50233: Flags [P.], seq 14864:15068, ack 1, win 501, options [nop,nop,TS val 1541172317 ecr 2776345223], length 204
21:34:52.582187 IP 137.184.160.43.22 > 198.96.85.163.50233: Flags [P.], seq 15068:15104, ack 1, win 501, options [nop,nop,TS val 1541172317 ecr 2776345223], length 36
21:34:52.582254 IP 137.184.160.43.22 > 198.96.85.163.50233: Flags [P.], seq 15104:15308, ack 1, win 501, options [nop,nop,TS val 1541172317 ecr 2776345223], length 204
21:34:52.582287 IP 137.184.160.43.22 > 198.96.85.163.50233: Flags [P.], seq 15308:15344, ack 1, win 501, options [nop,nop,TS val 1541172317 ecr 2776345223], length 36
21:34:52.582332 IP 137.184.160.43.22 > 198.96.85.163.50233: Flags [P.], seq 15344:15548, ack 1, win 501, options [nop,nop,TS val 1541172317 ecr 2776345223], length 204
21:34:52.582362 IP 137.184.160.43.22 > 198.96.85.163.50233: Flags [P.], seq 15548:15584, ack 1, win 501, options [nop,nop,TS val 1541172317 ecr 2776345223], length 36
21:34:52.582415 IP 137.184.160.43.22 > 198.96.85.163.50233: Flags [P.], seq 15584:15788, ack 1, win 501, options [nop,nop,TS val 1541172317 ecr 2776345223], length 204
21:34:52.605721 IP 137.184.160.43.22 > 198.96.85.163.50233: Flags [.], seq 15788:17026, ack 1, win 501, options [nop,nop,TS val 1541172341 ecr 2776345223], length 1238
21:34:52.646965 IP 198.96.85.163.50233 > 137.184.160.43.22: Flags [.], ack 15788, win 3352, options [nop,nop,TS val 2776345374 ecr 1541172317], length 0
21:34:52.646966 IP 198.96.85.163.50233 > 137.184.160.43.22: Flags [.], ack 17026, win 3354, options [nop,nop,TS val 2776345376 ecr 1541172341], length 0
21:34:52.647033 IP 137.184.160.43.22 > 198.96.85.163.50233: Flags [P.], seq 17026:17472, ack 1, win 501, options [nop,nop,TS val 1541172382 ecr 2776345374], length 446
21:34:52.665292 IP 198.96.85.163.50233 > 137.184.160.43.22: Flags [.], ack 17472, win 3367, options [nop,nop,TS val 2776345388 ecr 1541172382], length 0
^C
88 packets captured
106 packets received by filter
0 packets dropped by kernel